<?xml version="1.0"?>
<booksales       xmlns="http://www.w3schools.com"
	xmlns:xs="http://www.w3.org/2001/XMLSchema-instance"
	xs:schemaLocation="http://www.w3schools.com booksales.xsd">
<Authors>
	<Author>
		<ID>21f3</ID>
		<Name>Garth M Shelton</Name>
		<Email>gshelton@gmail.com</Email>
		<Phone>(470) 949-7859</Phone>
	</Author>
	<Author>
		<ID>14d3</ID>
		<Name>Beverly Rich</Name>
		<Email>beverly@deuce.net</Email>
		<Phone>(927) 407-2460</Phone>
	</Author>
	<Author>
		<ID>44K5</ID>
		<Name>Kibo X Carver</Name>
		<Email>carver@statichouse.com</Email>
		<Phone>(459) 376-6739</Phone>
	</Author>
	<Author>
		<ID>31R3</ID>
		<Name>Autumn Q Blevins</Name>
		<Email>aq@blevins.me</Email>
		<Phone>(996) 445-6213</Phone>
	</Author>
	<Author>
		<ID>19j6</ID>
		<Name>Amethyst D Fernandez</Name>
		<Email>ameth@deuce.net</Email>
		<Phone>(562) 559-8045</Phone>
	</Author>	
</Authors>
<Books>

	<Book>
		<ISBN>4756614025</ISBN>
		<Title>A Tale of Three Towns </Title>
		<Author>19j6</Author>
		<Formats>
			<Format>eBook</Format>
			<MSRP>12.99</MSRP>
		</Formats>
		<Formats>
			<Format>Hardcover</Format>
			<MSRP>24.00</MSRP>
		</Formats>
		<WeeksBSL>17</WeeksBSL>	
	</Book>
	<Book>
		<ISBN>4051865467</ISBN>
		<Title>Lord of the Crowns </Title>
		<Author>14d3</Author>
		<Author>19j6</Author>
		<Formats>
			<Format>Hardcover</Format>
			<MSRP>36.82</MSRP>
		</Formats>
		<Formats>
			<Format>eBook</Format>
			<MSRP>9.99</MSRP>
		</Formats>
		<WeeksBSL>17</WeeksBSL>	
	</Book>
	<Book>
		<ISBN>203387034X</ISBN>
		<Title>Of Cats and Men </Title>
		<Author>44K5</Author>
		<Formats>
			<Format>eBook</Format>
			<MSRP>4.99</MSRP>
		</Formats>
		<Formats>
			<Format>Hardcover</Format>
			<MSRP>26.49</MSRP>
		</Formats>
		<Formats>
			<Format>Paperback</Format>
			<MSRP>9.78</MSRP>
		</Formats>
		<WeeksBSL>52</WeeksBSL>	
	</Book>
	<Book>
		<ISBN>8496346865</ISBN>
		<Title>MacCharles</Title>
		<Author>21f3</Author>
		<Formats>
			<Format>eBook</Format>
			<MSRP>8.99</MSRP>
		</Formats>
		<Formats>
			<Format>Hardcover</Format>
			<MSRP>32.64</MSRP>
		</Formats>
	</Book>	
	<Book>
		<ISBN>1965685024</ISBN>
		<Title>Oliver Straight </Title>
		<Author>14d3</Author>
		<Formats>
			<Format>Paperback</Format>	
			<MSRP>8.99</MSRP>
		</Formats>
		<WeeksBSL>16</WeeksBSL>
	</Book>
	<Book>
		<ISBN>2031825889</ISBN>
		<Title>The Four Knights</Title>
		<Author>21f3</Author>
		<Author>31R3</Author>
		<Formats>
			<Format>Hardcover</Format>	
			<MSRP>22.73</MSRP>
		</Formats>
		<WeeksBSL>3</WeeksBSL>
	</Book>
	<Book>
		<ISBN>8020040696</ISBN>
		<Title>Paradise Found</Title>
		<Author>44K5</Author>
		<Author>31R3</Author>
		<Formats>
			<Format>Paperback</Format>	
			<MSRP>8.99</MSRP>
		</Formats>
		<Formats>
			<Format>Hardcover</Format>	
			<MSRP>22.73</MSRP>
		</Formats>
		<WeeksBSL>39</WeeksBSL>
	</Book>
	<Book>
		<ISBN>820778283X</ISBN>
		<Title>Twenty Shades of Cardinal </Title>
		<Author>31R3</Author>
		<Formats>
			<Format>eBook</Format>	
			<MSRP>6.49</MSRP>
		</Formats>
	</Book>

</Books>
<SalesInfo>
	<OneSalesInfo>
		<Book>203387034X</Book>
		<BookSales>
			<BookSale>
				<Format>eBook</Format>
				<Sales>
					<Sale>
						<Retailer>Amazon</Retailer>
						<Price>2.48</Price>
						<UnitsSold>200</UnitsSold>
					</Sale>
					<Sale>
						<Retailer>BN</Retailer>
						<Price>4.49</Price>
						<UnitsSold>173</UnitsSold>
					</Sale>
				</Sales>
			</BookSale>
			<BookSale>
				<Format>Hardcover</Format>
				<Sales>
					<Sale>
						<Retailer>Amazon</Retailer>
						<Price>24.99</Price>
						<UnitsSold>307</UnitsSold>
					</Sale>
					<Sale>
						<Retailer>BN</Retailer>
						<Price>24.99</Price>
						<UnitsSold>339</UnitsSold>
					</Sale>
				</Sales>				
			</BookSale>
		</BookSales>
	</OneSalesInfo>
	<OneSalesInfo>
		<Book>820778283X</Book>
		<BookSales>
			<BookSale>
				<Format>eBook</Format>
				<Sales>
					<Sale>
						<Retailer>BN</Retailer>
						<Price>3.25</Price>
						<UnitsSold>254</UnitsSold>
					</Sale>
					<Sale>
						<Retailer>Amazon</Retailer>
						<Price>5.00</Price>
						<UnitsSold>136</UnitsSold>
					</Sale>
				</Sales>
			</BookSale>
		</BookSales>
	</OneSalesInfo>
	<OneSalesInfo>
		<Book>4756614025</Book>
		<BookSales>
			<BookSale>
				<Format>eBook</Format>
				<Sales>
					<Sale>
						<Retailer>Amazon</Retailer>
						<Price>7.99</Price>
						<UnitsSold>162</UnitsSold>
					</Sale>

				</Sales>
			</BookSale>
			<BookSale>
				<Format>Hardcover</Format>
				<Sales>
					<Sale>
						<Retailer>Vromans</Retailer>
						<Price>16.74</Price>
						<UnitsSold>329</UnitsSold>
					</Sale>
				</Sales>				
			</BookSale>
		</BookSales>
	</OneSalesInfo>
	<OneSalesInfo>
		<Book>1965685024</Book>
		<BookSales>
			<BookSale>
				<Format>Paperback</Format>
				<Sales>
					<Sale>
						<Retailer>Amazon</Retailer>
						<Price>6.98</Price>
						<UnitsSold>73</UnitsSold>
					</Sale>
					<Sale>
						<Retailer>BN</Retailer>
						<Price>6.99</Price>
						<UnitsSold>93</UnitsSold>
					</Sale>
					<Sale>
						<Retailer>Vromans</Retailer>
						<Price>3.99</Price>
						<UnitsSold>200</UnitsSold>
					</Sale>
				</Sales>				
			</BookSale>
		</BookSales>
	</OneSalesInfo>
	<OneSalesInfo>
		<Book>4051865467</Book>
		<BookSales>
			<BookSale>
				<Format>Hardcover</Format>
				<Sales>
					<Sale>
						<Retailer>Vromans</Retailer>
						<Price>36.82</Price>
						<UnitsSold>135</UnitsSold>
					</Sale>
					<Sale>
						<Retailer>Amazon</Retailer>
						<Price>32.44</Price>
						<UnitsSold>164</UnitsSold>
					</Sale>
				</Sales>				
			</BookSale>
			<BookSale>
				<Format>Paperback</Format>
				<Sales>
					<Sale>
						<Retailer>Amazon</Retailer>
						<Price>8.99</Price>
						<UnitsSold>156</UnitsSold>
					</Sale>
					<Sale>
						<Retailer>BN</Retailer>
						<Price>3.26</Price>
						<UnitsSold>296</UnitsSold>
					</Sale>
				</Sales>				
			</BookSale>
		</BookSales>
	</OneSalesInfo>
	<OneSalesInfo>
		<Book>8496346865</Book>
		<BookSales>
			<BookSale>
				<Format>Hardcover</Format>
				<Sales>
					<Sale>
						<Retailer>Vromans</Retailer>
						<Price>29.99</Price>
						<UnitsSold>63</UnitsSold>
					</Sale>
				</Sales>
			</BookSale>
		</BookSales>
	</OneSalesInfo>
	<OneSalesInfo>
		<Book>8020040696</Book>
		<BookSales>
			<BookSale>
				<Format>Hardcover</Format>
				<Sales>
					<Sale>
						<Retailer>Vromans</Retailer>
						<Price>24.99</Price>
						<UnitsSold>273</UnitsSold>
					</Sale>
					<Sale>
						<Retailer>BN</Retailer>
						<Price>21.49</Price>
						<UnitsSold>394</UnitsSold>
					</Sale>
				</Sales>				
			</BookSale>
			<BookSale>
				<Format>Paperback</Format>
				<Sales>
					<Sale>
						<Retailer>Amazon</Retailer>
						<Price>8.99</Price>
						<UnitsSold>194</UnitsSold>
					</Sale>
					<Sale>
						<Retailer>BN</Retailer>
						<Price>7.99</Price>
						<UnitsSold>97</UnitsSold>
					</Sale>
				</Sales>				
			</BookSale>
		</BookSales>
	</OneSalesInfo>
</SalesInfo>
</booksales>

